file,line,sentiment,mixed,negative,neutral,positive,review
lil-review-j.csv,0,POSITIVE,0.2790142,0.130234659,0.002178893,0.588572323,"지인에게 선물 릴하이브리드 선택 후 만족도가 높아서 여기저기 추천하고 다녔는데, 지인께서 관심을 가지셔서 선물해드렸습니다.구입 후 가격이 다운되어서 살짝 배가 아프네요.암튼 지인 분도 이젠 완전히 연초를 끊었다며, 고마워하십니다.전담은 연초에 비할 바가 아닙니다.연초를 못 끊으신다면 전담으로라도 바꾸세요.특히 릴하이브리드의 장점은청소가 엄청 쉽죠. 배터리 오래가죠.액상비용이 따로 들긴하지만, 그만큼분무량도 꽤 좋고, 오히려 경제적인 아이러니한 경우가 생깁니다. (사용하시는 분들은 다 아는..)내구성도 초창기 1.0 제품보다 좋아졌습니다.예전 제품은 뚜껑이 금방 고장났었죠.연초 냄새, 너무 역해요.저 역시 완전 금연은 못하고 전담만 몇년째 사용 중인데,연초 냄새는 너무 고약해서 근처도 못 갑니다.이건 다른 궐련형 전담 제품보다도 냄새가 거의 없어요.일단 전담을 피고 있지만, 언젠가 완전 금연!모두 금연에 성공하시기 바랍니다."
lil-review-j.csv,1,NEGATIVE,2.27E-05,0.990969479,3.31E-04,0.008676345,2년 잘쓰던 스페어용 릴2.0 이 사망.. 스틱을 꼽아도 반응도 없고 .. 결국 스페어는 그렇게 가버렸네요그래서 2년까진 아무탈없이 쓸수있게 재구매를 하네요나름 무게감 있는 아이언 실버 색상으로 사길 잘한듯 합니다뭐든 질리지 않는 색상으로 사야 오래쓰더라구요 ^^12개월 as가능하니 안심하고 사용할수 있을거같습니다
lil-review-j.csv,2,POSITIVE,0.002847771,0.311354816,0.002331923,0.683465481,"만족도 100% 제품입니다! 4년 동안 묵혔던 릴1을 최근다시 사용하기 시작했는데,모두 분리해서 블레이드를 청소해도결국은 세월은 못 이기더군요.그래서 이것저것 1달을 고민하다가다시 이 제품으로 선택했는데요.이유는 일단 AS와 연무량이었어요.어제 4가지 믹스를 태워봤는데,종류별로 연무량은 차이가 나더라구요.그래두는 청소 관리 부분과 탄맛은전혀 없어서 아주 대만족입니다.블로그에 자꾸 차xxx 홍보하는데그냥 믿을 수 있는 이 제품으로선택하세요."
lil-review-j.csv,3,POSITIVE,0.19277361,0.089957878,6.98E-04,0.716570914,"컬러 굿, 그립감 굿 편의점서 쿠폰써서 88인데,세일 중이여서 쟁였어요! 68에 샀는데;; 싸다구 ^^늘 사용하던건 매트블랙 ! 실버도 너무 이뻐요 ! 화이트보단 블랙! 블랙보단 실버가 이쁘네요!! 무광이 아니라 건조한 손엔 미끄러져요.작동도 잘되고 케이스도 들뜸 없음.사용해보신분들은 잘 아시겠지만, 카트리지 다 쓴 거뺏다껴도 full 로 떠요 ㅋㅋ 머신멍청이!!가성비 연초보다 훨 나아요! 갈아들 타세요. 냄새도 없구요2.0강추"
lil-review-j.csv,4,POSITIVE,0.106078543,0.138743311,6.81E-04,0.75449723,남자친구가 기존에 쓰던거 잃어버려서 새로 재구매했어요편의점에서 사는거보다 훨씬 저렴하고 다음날 배송와서 좋았고구성품에 전용 충전기랑 클리너 들어있어서 좋았어요전원 눌렀는데 안켜져서 왜 안켜지나 했는데 휴면상태를 해지해줘야되더라구요전용 충전기 누르니가 바로 켜졌어요액상이 아니라 한대피면 자제할수있어 좋고 연초 냄새 안나서 좋아요무게는 대충 핸드폰정도? 들고다닐만 하더라구요
lil-review-j.csv,5,MIXED,0.605788708,0.379367948,9.24E-04,0.013919799,삶에 질이 조금은 상승? 연초를 피는 사람인데 집에선 담배를 못 피니까 액상 전담을 사용했어요 그래도 제 몸에서 담배 냄새가 그득그득.. ㅠㅠ담배는 피우고 싶고 냄새는 싫고 근데 찐 담배 냄새가 더 싫은 1인이었는데 .. 주변 사람들이 릴로 점점 옮기더라고요?한번 펴보자 해서 했는데 오? 생각보다 괜찮은데?생각보다 찐 내가 별로 안 심해서 바로 주문했습니다 단점은 솔직히 연초보다 비싸요 액상까지 따로 사면 오천원이니까 가격도 비싸고 충전도 시켜줘야 해요 이틀? 은 가는 것 같아요 담배 기준으로 1갑 반에서 2갑? 까지는가는 것 같아요!근데 단점이 있지만 장점이 너무 커서 단점은 1도 생각안나요ㅋㅋ일단 냄새 제로!저는 서비스직 일을 해서 아직도 마스크를 착용을 하고 있어요담배 피우면 진짜 입 냄새.. 하.. 솔직히 좀 많이 나는 거 아시죠?근데 입 냄새도 진짜 많이 줄었어요 저는 진짜 100프로 만족합니다!
lil-review-j.csv,6,MIXED,0.685998976,0.260177791,9.87E-04,0.052836381,"좋아요 올블랙 피플인 저는 좀 맘에 안 들었지만때 타는 흰색? 보다는 훨씬 좋고블랙 보다는 마음에 안들지만그래도 은색은 그래도쌔끈 빠끈한 섹쉬한 색상이라밖에서 꺼내 피기에 완전한 남자으 색상인것 같아피고 있어요디자인 이야긴 여기까지만 하고진짜 중요한 빳데리 이야기를 하자면완전 좋은게제가 한 2주 안쓰다 써보기도 했고(연초 피워서)4주 안 쓰다 (집에서 연초 안 피고, 전담으로 갈아 피운거 몰라서)(또 전담 핀다고... 아~! 과거에 아이코스 첨 나왔을때 2주도 안피고 누구 준거 아는 어머니가 잔소리 할까봐)한동안 집에서는 연초를 일부러 태웠는데그러다 보니 가끔 펴봤는데 밧떼리 영향 1도 없네요물론 중도에 많이 피는 위치가 사무실에서 재택근무로 바꺼서 상위에 일들이 일어난 거지만 만약 계속 사무실 근무했으면얘만 피웠을 것 같아요임마 이게 연초나 전담이나구별 못 할 정도로 닮아서 다른 전담 보다는 훨씬 적응 하기 쉬운놈 인거 같아요 ㅎㅎ전담으로 넘어가려는 자이놈을 거치시길 바랍니다.담배 끊으려고 샀었는데이게 담배인가 전담인가 의싱 될 수준에비슷하지만 다른 전담 되겠심다.ㅋㅋㅋㅋ담배(궐련형 담배)개인적으로 어떤게 좋다 말하지 못합니다갠취가 있으니까저는 알로하 피는데 이거는 냄새가 나쁘지 않아서 비흡연 여성들이 냄새 안난다고 좋아 합디다 ㅎㅎㅎ행복한 저녁 되세요~~!!솔로인 남자분들ㅋㅋㅋ아니 담배광고인가이거 홍보인가 헷갈리지만여튼 그래요 이만다시 한잔하러 총종총 with.저 와이프 생길 것 같은 술집 화장실에서면 from.이라 해야 하는가? 여튼..."
lil-review-j.csv,7,MIXED,0.960915864,0.036380228,3.10E-04,0.002393719,전자담배는 릴 하브 전 전자담배 기기 욕심이 많은 편입니다.아이코스 > 릴2.0 > 릴 에이블 > 릴 하브로 갈아탔네요.아이코스는 담배 종류와 맛이 마음에 들지 않았습니다.릴2.0은 담배 맛은 좋았지만 향이 마음에 들지 않았습니다.릴 에이블은 카트리지 교체도 없고 향은 좋았지만 담배 종류가 많지 않았습니다.그리하여 최종적으로... 릴 하브.. 역시.. 제일 많이 팔린 데에는 이유가 있습니다.믹스 종류도 다양하고 향도 마음에 들고 연무량까지 마음에 듭니다.하지만 전자담배 특성상 한개피 피는 횟수는 조금 아쉽네요.담배피는 주제에 무슨 건강 생각하겠다고 이것저것 피는지 원..전자담배 중에는 릴하브가 제일 낫네요.
lil-review-j.csv,8,NEGATIVE,0.030721348,0.861417711,0.066118367,0.041742608,"첫 전담인데 목아픔.. 연초도 멘솔을 폈어서 전담도 멘솔을 샀음.기기자체는 처음 사용이라 좋다말다는 모르겠음.액상담배에 필터를 추가하는 방식. 액상의 부작용으로 많이나오는 목아픔현상. 처음 시작할때부터 목넘김이 따갑다 싶었는데 자고일어나니 목이 턱 막힌듯 아프고 답답해짐.물 자주먹으래서 흡연전후로 마셔주고, 카투리지 청소도 해보고, 액상에 공기유입 있진 아노아도 흔들어서 공기방울 안생기게 해두고.. 목아픔현상시 해보라는거 해봐도 여전히 따갑고 아픔..적응되면 덜하려나 싶다가도 피우는 시간텀이 늘어나고 연초에 손이감.기기발열은 어느정도가 정상인지 모르지만.. 사용시 필터부부인 따뜻해진다는 정도임.14번 흡입후 필터를 빼면 중간부분이 변색되어 있는데 이게 탄건지 정상인지는 모름. 월요일에 물어볼 예정임.***목아픔 빼면 재털이냄새없이 흡연가능. 찐한 단내가 남-이건 호불호일듯한데 나는 불에 더 가깝.. 잔량표시가 부정확함. 액정은 베터리만 확인하고 카트리지잔량은 직접 눈으로 확인하는게 나을듯."
lil-review-j.csv,9,NEGATIVE,5.73E-04,0.834544301,0.001014646,0.163867787,"이지 사지말고 돈 더 모아서 이거 사세요 꼭!! 디스플레이에 남은 횟수랑 배터리가 나오니까 잘 피다가 담배 흐름 끊기는 느낌도 덜하고, 챙겨나왔는데 배터리 없어서 연초 피게되는 그런 실수도 덜하니까 너무 좋습니다UUU처음에 전원 버튼이 어디있는지 몰라서 한참 찾았는데 알고보니 디스플레이 상단에 있었네요담배 입구 부분 슬라이드가 부드럽게 착! 감기는 느낌이라 자꾸 열고 닫게 되는데 중독성 있습니다,,그리고 무엇보다 색상이 정말 심플하고 이뻐요. 촌스럽지 않고,,,이지랑 2.0이랑 고민하다가 첨 사용해보는 거니까 이지 썼었는데 카트리지 액상이 맨날 새고... 가끔 맛도 이상하고... 결국 2.0을 또 구입하게 되네요;; 돈 아낀다고 이지 사지마시고 그냥 처음부터 2.0 사시길 바람"
lil-review-j.csv,10,POSITIVE,0.025077052,0.202204481,0.002745867,0.769972563,나는 찐내싫다 연무량많은게좋다하면 릴 강추 주변에서 다 노담하거나 궐련형쓰는 추세라 저도 따라 아이코스 샀는데 아 저는 그 아이코스 특유의 찐내도 너무 싫고흡연하러가서 맛이없으니까 오히려 더 스트레스받고오더라고요주변에서 추천해주길래 구매했는데 너무 좋네요아 확실히 카트리지 인식 잘 못하는군 있는듯하네여 새거 사다가 꽃았는데 카트리지 없다구떠서 뺐다꼽으면되구 무튼 그런거저렁거 다 빼고 좋네요
lil-review-j.csv,11,MIXED,0.935148358,0.059134085,6.62E-04,0.005055554,마음에 들어요 일요일 주문배송 지연으로 월욜 오후 수령후기쓰는 오늘이.ㅜㅜ수령한지 3일째인 수욜인데변기에 빠트려 쑥 들어갔어요.ㅠㅠ변기물이 차올라 펌프질을 얼마나했는지 변기 뜯어야하나(회사 변기)ㅠ오늘 쌩고생을ㅠ나쁘지않아요..그런데 7만원이 쑹~날라가서재구매는 고민이고친구가 대리 구매 해달라해서같은 색상 주문해줬는데바라보면 맘 아플듯ㅠ주의 : 장실 들고가지마세요.저도 피는곳은 다른곳인데삼실 가져다두고 장실가기 귀찮아서ㅠ 갔다가 봉변.이런 케이스 많더라구요 검색하니다들 조심!!
lil-review-j.csv,12,NEGATIVE,0.009839401,0.703232527,0.005122912,0.281805187,가성비 좋은 전자담배에요 남친이 연초 끊고 싶다고해서 생일선물겸 저도 같이 릴 하이브리드 2.0 두개를 구입했습니다.이게 복불복인건지 카트리지 한개당 믹스한갑 분량이라고 했는데 남친은 한갑분량이 되고 저는 한갑을 다 못피고 카트리지가 떨어지더라구요두번째도 그래서 세번째두 그러겠지 했는데 이번에는 한갑을 다 피웠는데 카트리지가 떨어졌다고 떠서 열어서 확인해보니 반이나 남아있더라구요 카트리지를 뺐다가 다시 꼈더니 풀이라고 떠서 17가치정도 피니깐 떨어져요 왜이러는걸까요~?이런점만 빼면 재탕이 가능해서 담배값도 아낄수있는 장점이 있어서 일단 계속 사용해보려구 합니다.남친은 이상없다고 좋다고 합니다그리고 제가 두번까지 재탕해봤는데 두번 재탕은 좀 타격감이 많이 약해져서 재탕은 한 번만 하는 걸 추천합니다.
lil-review-j.csv,13,POSITIVE,0.006919969,0.125378922,0.004926506,0.86277467,지금껏 경험해본 전담중 최고 연무량과 맛 그리고 특유에 찐담향이 안나서 너무 좋습니다. 기기값은 어디서 구매하나 같아서 빠른배송 쿠팡에서 구매 했어요.하이브리드 처음 접하시는 분들은 담배값과 액상값 계산들 해보셨을겁니다. 액상 오백원 담배값 사천오백원 하면 일반 연초보다 금액이더 비싸게 계산되기 마련인데 한가지 요전담에 팀을 드리면 담배를 한번 피우고 버리지마시고 2회에서 3회까지 피우셔도 향은 처음만 못하지만 연무는 액상빨로 나오는것이기 때문에 전혀 흡연 활동에 전혀 지장없습니다. 주변에 그렇게 피우시는분들 많네요ㅋ담배값을 3분에 1로 줄이는 좋은 아이템 입니다ㅋ
lil-review-j.csv,14,POSITIVE,4.90E-04,0.111604787,0.146068439,0.741836429,처음부터 카트리지 용량 파악을 얘가 못해서 눈으로 잘 확인하고 교체시기에 잘 교체 바랍니다.
lil-review-j.csv,15,POSITIVE,0.001045821,4.93E-05,6.29E-05,0.998842061,너무 예쁩니다 색도 디자인도 넘 이쁘고 고급져요 실물이 더 예쁩니다솔리드에서 갈아탔어요 만족합니다
lil-review-j.csv,16,MIXED,0.938639045,0.001982021,0.031052314,0.028326642,실사용 후기 배터리용량 :23개비 정도 사용가능액상용량: 동일하게 23개비 정도내구성: 안 쩔어트려서 모름 그러나 주위사람들 말로는 준수한편이라고함디자인: 맘에 안들면 케이스.스티커 등 선택 다양무게: CSV들보단 무겁지만 신경 안쓰이는정도종합: 맛은 호불호가 많이갈리겠지만 성능은 굿 주변에 추천할정도는됨
lil-review-j.csv,17,NEGATIVE,2.41E-04,0.586833954,0.002120371,0.41080454,연초 피우는 친구한테서 재떨이 냄새가 나길래 깜짝 놀라서 저도 연초 끊고 이걸로 바꿨는데 멘솔 피우니까 타격감도 적당하구 연초 생각도 안나네요!! 지금 가격도 많이 저렴해져서 메리트 있는거 같아요!
lil-review-j.csv,18,POSITIVE,0.046718024,0.002402823,7.72E-04,0.95010668,남편이 새해에는 담배를 줄여 보겠다고 전자담배로 바꿔보겠다고 사달라하여 구매하게 되었어요.알아본 봐로는 릴 하이브리드2.0이 가장 평도 좋고 마음에 들었나봐요. 편의점에서 구매하려니 예약해야 된다고 하기에 쿠팡 로켓으로 주문했어요.전자담배도 쿠팡에서 구매 할 수 있다니 놀랍고 편한 세상에 살고 있는것 같아요.디자인도 실버라 깔끔하고 예쁘네요.전담이 연초보다는 타격감이 적겠지만 남편이 노력해 보겠다고 하니 믿어봐야죠.가격 결코 싸지는 않지만 남편이 이것도 이제는 저렴히 파는거라고 하네요.남편이 색상도 그립감도 좋다고 만족하네요.
lil-review-j.csv,19,NEGATIVE,0.403361291,0.56848675,3.52E-04,0.027799916,릴이지쓰다 고장나서 주문했어요 릴이지 구매한 지 5개월 조금 안됐는데액상누수로 전원이고 충전이고 지 마음대로 되고 싶을때만 되길래서울북부지점에 수리하러 갔더니 뚜껑빼고 뒤집어서 털면 누수된 액상나온다고털어서 쓰라길래 이게 수리인가 열받아서 주문했어요그래서 색상 대충보고 주문했는데 할아버지 은단색상이 왔어요제대로 안 본 제 잘못입니다 ㅠㅠ제품은 마음에 들어요 역시 2.0이 좋네요릴이지 쓰실 분들 그냥 3만원 추가해서 2.0 사세요 제발 ㅠㅠ릴이지에 비해 빨아들이는 느낌도 훨씬 부드럽고 진동도 고급져요릴 하이브리드 시리즈 다 써봤지만 역시 2.0이 최고에요
lil-review-j.csv,20,NEGATIVE,1.77E-05,0.670832872,0.320952088,0.00819736,"타격감은 중간정도이고 흡입할때 기계소리?가 나고 기계도 뜨끈뜨끈해지고 꽂는것고 뜨거워져요!연초 생각나서 병행하게 되네여,,"
lil-review-j.csv,21,NEGATIVE,3.20E-06,0.999347627,4.78E-04,1.71E-04,충전은 꼭 해당 같이오는 충전기로 하세요 아무도 나에게 알려주지않음 ㅜㅜㅜㅜㅜㅜㅠㅠㅠ 연초 10년폈다가 처음으로 궐련형으로 샀는데 그냥 집에있는 충전기로 충전했더니 지혼자서 갑자기 담배도 안꽂았는데 불들어오고.. as센터가니 얘 전용 충전기로만 하라는소리들음 까다로운놈..
lil-review-j.csv,22,POSITIVE,4.55E-04,0.333661884,0.193034068,0.472848564,구매가 69000세일하길래 구입했어요 그런데 잠깐세일이 아니라 재고떨이인지 계속 이가격에 판매중이네요 ㅋ;
lil-review-j.csv,23,MIXED,0.680487752,0.258339942,2.64E-04,0.060907815,연초에서 갈아탔어용. 첨에 2.0사기 부담스러워서 하이브리드 ez로 시작했는데떨어뜨려서 액상 줄줄 새는 김에 함 사봤습니다! 색도 너무 이쁘구 진짜 맛있어요ㅠㅠㅠ인터넷이 ez나 2.0이나 똑같다 그래서 싼거 산거였는데 아닙니다...진짜 맛이 아예 달라요ez는 너무 뻑뻑하고 컥컥거리게 되는 그럼 느낌이라 진짜 못피겠던데 얘는 완전 부드럽습니다연초에서 갈아타려는데 비싸서 고민인분들은 그냥 2.0사셔요...ez사지 말아요 진짜 노맛임 목아파서 못펴요
lil-review-j.csv,24,POSITIVE,0.151494384,0.030102318,6.44E-04,0.817759037,색상 아주 고급짐 첫 릴 사용으로 좋은기억만 안고 가는데 첫 제품의 색상은 블랙사용하며 잘쓰다가 잃어 버렸습니다..그러던 중 다시 연초로 갈아 탔지만 연무감 좋고 쩐내도 나지 않은 이 릴 제품을 다시 구입 하였습니다 블랙 색상은 많은 사진 리뷰가 있었는데 이 실버제품은 리뷰가 없기에 하나 올려요 처음에는 화이트 색상으로 구입 하려 했으나 실버 상당히 고급지고 볼매입니다 ~블랙 화이트에 비해 저는 실버 아주아주 마음에 들어여~ 잘 피고 잘 갖고 다니렵니다~
lil-review-j.csv,25,MIXED,0.981399119,0.014470151,0.001302701,0.002827988,좋아요 화이트 블랙 이번엔 실버까지 구매하게 _요 카트리지 용량 표시가 정확하지 않을때도 있지만요 연초는 싫고 믹스가 좋아서요
lil-review-j.csv,26,MIXED,0.87766999,0.085417062,0.024678912,0.012234157,밧데리 수명좀 늘려주면 좋으련만.....1년도 안되 바꾸게 만들고....
lil-review-j.csv,27,POSITIVE,2.43E-05,1.91E-05,1.74E-04,0.999782383,빠른배송 감사합니다. 예쁘고 좋네요 수고하세요 사이즈 디자인 오두 100% 맘에 듭니다.감사합니다 많이 파세요 전자담배 하실분 꼭 추천합니다.
lil-review-j.csv,28,NEGATIVE,0.001792711,0.909769118,0.065743238,0.022694957,"편의점에서 구매한거랑 다른가봐요? 편의점에서 구매해서 사용했었는데, 어제 분실해서 로켓배송으로 구매했습니다. 정확하게 기억이 나진 않지만 약 2달전 편의점에서 구매했었고, 구성품으로는 본체+충전기 였던 것으로 기억해요.로켓배송으로 구매해서 보니까 본체+충전기 외에 클리닝 핀, 클리닝 스틱이 들어있네요? 리뉴얼 되었는지는 잘 모르겠습니다.어쨌든, 사용하는데 카트리지를 뺏다 끼거나, 윗부분 뚜껑을 뺏다 끼는데 이전보다 더 견고한 느낌이예요. 저는 조금 빡빡한(?) 느낌이 더 안전해보여서 마음에 들더라구요.또 은색 생상도 생각했던 것 보다 더 마음에 드는 것 같습니다."
lil-review-j.csv,29,NEGATIVE,2.17E-05,0.999611676,6.07E-05,3.06E-04,몇달 사용중인데 사고나서 3일째부터 두모금째되면 항상 분리됐다는 표시 뜨면서 꺼짐초기화시켜도 계속 재발해서 킹받았는데 일하니까 서비스센터 갈 시간이 없어서 그냥 저냥 씀요즘은 날이 슬슬 풀려서 그런지 그런 현상이 줄었는데 여러모로 좀 별로임. 액상도 반틈 남았는데 최저라고 뜨고..
lil-review-j.csv,30,MIXED,0.78304261,0.013876491,4.64E-05,0.203034386,색감 너무 예쁨 일단 저는 릴을 1년이상 기본적으로 사용한 사람으로써 다른 전담에 비해 가장 찐내 비린내가 안나고 타격감도 괜찮고 편하고 예쁘고해서 두개로 충전 돌려가면서 썼습니다.오래쓰다보니 에러가 나더군요 그리고 몇번 떨궈서 안에 충전하는게 깨져서 하나 버리게되면서 제가 좋아하는 실버가 나왔길래 냉큼 구매했습니다 색감 예쁘고 사용감은 뭐 말할것 없이 좋아요.
lil-review-j.csv,31,NEGATIVE,5.47E-04,0.6121912,0.295983702,0.091278069,시대에 따라가자 연초피면 범죄자 되는 것 같은 분위기에 반강제적 전자담배로 갈아탔습니다 집에서 펴도 쩐내가 안나서 좋아요~
lil-review-j.csv,32,NEGATIVE,9.06E-05,0.973162234,0.007064397,0.019682761,"써보니 자주 청소 할필요없음배터리는 조루임.2번 베이핑 햇는데 10프로가 달아있음..ㅡ.,ㅡ완충해도 하루를못버틸거같은 불안감카트리지는 따로구매 해야하고 인식률 저조이게 왜 8만원대인지 모르겠음..히츠/핏 호환안됨 믹스만 사서 베이핑 해야하는데 연초피다 이거 입문하면 하루에 3갑은 펴야 만족할꺼임장점은 잿가루가 안남는거랑 연초 생각이 안난다는점이거 2개임 딴 장점없음"
lil-review-j.csv,33,POSITIVE,1.20E-04,7.46E-04,0.002051397,0.997082531,담배쩐내때문에 구매했는데 괜찮네요 불량이 많다는데 불량도 없고 잘 쓰고있습니다
lil-review-j.csv,34,NEUTRAL,1.54E-04,0.080195613,0.880810082,0.038840078,에이블 사려다 다시 하이브리드 2.0 으로 왔습니다만-족
lil-review-j.csv,35,NEGATIVE,3.87E-06,0.999612272,2.74E-04,1.10E-04,한번씩 작동이 안된다네요카트리지 다시 뺐다켜야 작동되요보름도 안됐는데 벌써 세번째 그런다네요 ㅡㅡ
lil-review-j.csv,36,NEGATIVE,6.24E-05,0.990316212,0.003052033,0.006569291,"오류 헤드가 있는데 없다던가 스틱이 없다던가 오류는 좀 뜨는편 하지만 10년 가까이핀 연초를 끊었다,,,,!!아기키우면서 담배도 육퇴하고피는데 죄_감들어서 사봄 ㅎㅎ 결론은 대만족"
lil-review-j.csv,37,POSITIVE,8.95E-05,0.001218985,0.012794683,0.985896766,친구소개로구매햇는데기존쓰던것보다충전됴오레갸고좋다 친구 소개로 구매햇는데 기존 쓰던것보다 충전됴 오레갸고 좋으다
lil-review-j.csv,38,POSITIVE,1.67E-05,4.73E-04,0.009204316,0.990306377,연초에서 전자담배로 갈아타려고 샀는데 아주 잘 쓰고 있습니다
lil-review-j.csv,39,POSITIVE,3.79E-04,0.001730024,0.012865888,0.985024989,"고민끝에 이거저거 비교해보다 골랐는데 잘고른듯싶습니다.몇몇분이 불만족이 있으셔서 찜찜하게 선택한건맞는데,저는 아주 잘산듯하고,불편함도없고 만족합니다."
lil-review-j.csv,40,MIXED,0.78318882,0.13145183,0.00210426,0.083255105,편의점에서만 구매하다가 쿠팡에서도 팔길래 사봤어요실버는 처음보는데 이쁘네요^^릴2.0은 잔고장이 너무 많아요;서비스센터도 많이없고...
lil-review-j.csv,41,POSITIVE,5.92E-04,1.99E-04,5.86E-05,0.999150991,색이 오묘한게 이뻐요 화이트 컬러로 사용했었는데새로운 색이 나오고 잃어버리기도 해서 구매했는데만족스럽습니다~
lil-review-j.csv,42,NEGATIVE,0.001423481,0.573425889,0.054411408,0.370739251,가래도 안 끌고 모든 사람들 연초 끊게 하고싶어요손님들 다 사주고싶어요 릴 참 좋네요연초 기침나오고 냄세나고 입 냄세 옷에 베이는 냄세죽겠네요
lil-review-j.csv,43,NEGATIVE,6.44E-04,0.993950725,0.002761219,0.002644184,"똑같은걸로 검정색 쓰고 있는데,연무량도 별로고 한두번 흡입하면 연기도 안나고 빨리지 않아서 기계문제인가 싶어서 다시 같은걸로 색만 바꿔서 삿는데 이것도 마찬가지네요 ㅠ 검정색보다 리셋도 느리고 묵짐함은 덜하고 시간단축도 빠르네요~~내것만 이런건지?다른사람꺼 는 안그러던데 as도 불편하고 어찌할지 ㅠ대략난감 복불복인가요?다른사람꺼는 이러지않던데 ㅠ"
lil-review-j.csv,44,NEUTRAL,1.65E-04,0.013979804,0.811856449,0.173998833,베리베리굿 입니다
lil-review-j.csv,45,POSITIVE,1.05E-04,1.19E-04,0.001545722,0.998230994,굿 굿
lil-review-j.csv,46,NEUTRAL,2.99E-04,0.133064017,0.683645427,0.182991952,단말기 에러가 상당합니다.. 스틱+카트리지 조합인데..
lil-review-j.csv,47,POSITIVE,0.012746771,0.016406128,0.001063234,0.969783843,아주 만족해요 대신 잃어버려서 다시구매 오늘도착할뜻
lil-review-j.csv,48,POSITIVE,1.31E-05,0.001267213,0.00277838,0.995941341,너무너무나 맘에 들어요!
lil-review-j.csv,49,POSITIVE,3.40E-05,8.20E-04,0.042414166,0.956731796,친구소개로구매햇는데기존쓰던것보 충전됴오레갸고좋다 써보고 좋아서 지인에게 선물함
lil-review-j.csv,50,POSITIVE,2.84E-04,0.25994432,0.058857646,0.680913746,남편 주려고 샀어요 무엇보다 담배 냄새는 안나서 좋아요
